<?xml version="1.0" encoding="utf-8"?>
<Opus:PackageDefinition xsi:schemaLocation="http://code.google.com/p/opus ./Schema/OpusPackageDependencyV2.xsd" xmlns:xsi="http://www.w3.org/2001/XMLSchema-instance" xmlns:Opus="http://code.google.com/p/opus">
  <Opus:RequiredPackages>
    <Opus:Package Name="C">
      <Opus:Version Id="dev" />
    </Opus:Package>
    <Opus:Package Name="Clang">
      <Opus:Version Id="3.1" />
    </Opus:Package>
    <Opus:Package Name="ComposerXE">
      <Opus:Version Id="12" />
    </Opus:Package>
    <Opus:Package Name="FileUtilities">
      <Opus:Version Id="dev" />
    </Opus:Package>
    <Opus:Package Name="Gcc">
      <Opus:Version Id="4.0" Condition="'$(Platform)' == 'OSX'" />
      <Opus:Version Id="4.1" Condition="'$(Platform)' == 'Windows' || '$(Platform)' == 'Unix'" />
      <Opus:Version Id="4.4" Condition="'$(Platform)' == 'Windows' || '$(Platform)' == 'Unix'" Default="true" />
      <Opus:Version Id="4.5" Condition="'$(Platform)' == 'Windows' || '$(Platform)' == 'Unix'" />
      <Opus:Version Id="4.6" Condition="'$(Platform)' == 'Windows' || '$(Platform)' == 'Unix'" />
    </Opus:Package>
    <Opus:Package Name="MakeFileBuilder">
      <Opus:Version Id="dev" />
    </Opus:Package>
    <Opus:Package Name="Mingw">
      <Opus:Version Id="3.4.5" Default="true" />
      <Opus:Version Id="4.5.0" />
    </Opus:Package>
    <Opus:Package Name="NativeBuilder">
      <Opus:Version Id="dev" />
    </Opus:Package>
    <Opus:Package Name="QMakeBuilder">
      <Opus:Version Id="dev" />
    </Opus:Package>
    <Opus:Package Name="VisualC">
      <Opus:Version Id="10.0" />
      <Opus:Version Id="11.0" />
      <Opus:Version Id="8.0" />
      <Opus:Version Id="9.0" Default="true" />
    </Opus:Package>
    <Opus:Package Name="VSSolutionBuilder">
      <Opus:Version Id="dev" />
    </Opus:Package>
    <Opus:Package Name="WindowsSDK">
      <Opus:Version Id="6.0A" Default="true" />
      <Opus:Version Id="7.1" />
    </Opus:Package>
  </Opus:RequiredPackages>
  <Opus:RequiredOpusAssemblies>
    <Opus:OpusAssembly Name="Opus.Core" />
  </Opus:RequiredOpusAssemblies>
  <Opus:RequiredDotNetAssemblies>
    <Opus:DotNetAssembly Name="System" RequiredTargetFramework="2.0.50727" />
    <Opus:DotNetAssembly Name="System.Xml" RequiredTargetFramework="2.0.50727" />
  </Opus:RequiredDotNetAssemblies>
  <Opus:SupportedPlatforms>
    <Opus:Platform Name="Windows" />
    <Opus:Platform Name="Unix" />
    <Opus:Platform Name="OSX" />
  </Opus:SupportedPlatforms>
</Opus:PackageDefinition>